Candidate_Name,Party,Status,Context
Prashant Kishor,Jan Suraaj,"Founded party, did not contest personally",Party failed to win any seat
Tej Pratap Yadav,Janshakti Janta Dal,"Finished 3rd in Mahua with 34,000 votes",Lost to LJP(RV) by large margin
Various Congress Leaders,INC,Congress won only 6 seats (down from 19),Major setback for Congress in Bihar
Mukesh Sahani (VIP),VIP,VIP won 0 seats (despite being in MGB),Failed to capitalize on alliance
Jan Suraaj Candidates,Jan Suraaj,Lost deposits in 236 of 238 seats,Massive debut failure
